{
  "$schema": "https://json-schema.org/draft/2020-12/schema",
  "$id": "https://github.com/investash/dados-economicos/esquemas/v1/metadados-serie.schema.json",
  "title": "Metadados de série — schema v1",
  "description": "metadados.json de uma série. Autoexplicativo para humanos, aplicações e LLMs.",
  "type": "object",
  "additionalProperties": false,
  "required": [
    "identificador",
    "nome",
    "descricao",
    "categoria",
    "provedor",
    "moeda",
    "frequencia",
    "unidade",
    "primeira-observacao",
    "ultima-observacao",
    "status",
    "versao-schema",
    "referencia-oficial",
    "ultima-alteracao-dados",
    "versao-sneffelz"
  ],
  "properties": {
    "identificador": {
      "type": "string",
      "description": "Identificador público da série (lowercase, hífen, sem acentos).",
      "pattern": "^[a-z0-9]+(-[a-z0-9]+)*$"
    },
    "nome": { "type": "string", "description": "Nome oficial da série em PT-BR." },
    "descricao": { "type": "string", "description": "Descrição semântica da série." },
    "categoria": {
      "type": "string",
      "enum": ["inflacao", "taxas-de-juros", "taxas-de-cambio"]
    },
    "provedor": {
      "type": "string",
      "enum": ["BACEN"],
      "description": "Provedor da API que divulga a série (fonte da verdade)."
    },
    "instituicao-responsavel": {
      "type": ["string", "null"],
      "description": "Instituição que calcula/publica a série (ex.: IBGE, FGV, FIPE), quando aplicável."
    },
    "codigo-sgs": {
      "type": ["integer", "null"],
      "description": "Código da série no SGS do BACEN, quando aplicável."
    },
    "moeda": {
      "type": "string",
      "description": "Código monetário ISO 4217 quando aplicável (ex.: BRL, USD)."
    },
    "frequencia": {
      "type": "string",
      "enum": ["diaria", "mensal", "anual"]
    },
    "unidade": { "type": "string", "description": "Unidade de medida (ex.: % a.m., BRL)." },
    "primeira-observacao": {
      "type": ["string", "null"],
      "description": "Data ISO-8601 da primeira observação disponível.",
      "pattern": "^\\d{4}-\\d{2}-\\d{2}$"
    },
    "ultima-observacao": {
      "type": ["string", "null"],
      "description": "Data ISO-8601 da última observação disponível.",
      "pattern": "^\\d{4}-\\d{2}-\\d{2}$"
    },
    "status": {
      "type": "string",
      "enum": ["ativa", "inativa"],
      "description": "ativa = sincronizada; inativa = a fonte deixou de publicar (histórico preservado)."
    },
    "versao-schema": {
      "type": "string",
      "const": "v1"
    },
    "referencia-oficial": {
      "type": "string",
      "description": "URL da documentação/endpoint oficial da fonte."
    },
    "ultima-alteracao-dados": {
      "type": ["string", "null"],
      "description": "Data da última alteração EFETIVA dos dados (não é timestamp de execução).",
      "pattern": "^\\d{4}-\\d{2}-\\d{2}$"
    },
    "versao-sneffelz": {
      "type": "string",
      "description": "Versão do Sneffelz que produziu a última alteração de conteúdo."
    },
    "tipo-serie": {
      "type": "string",
      "enum": ["escalar", "cambio"]
    },
    "armazenamento": {
      "type": "string",
      "enum": ["agregado-e-anual", "particionado-anual"],
      "description": "Estratégia de storage da série. agregado-e-anual = valores.json + anos/*.json; particionado-anual = apenas anos/*.json (valores.json NÃO deve existir)."
    },
    "particionamento": {
      "type": "string",
      "const": "anual",
      "description": "Granularidade das partições (v1: sempre anual)."
    },
    "agregado-disponivel": {
      "type": "boolean",
      "description": "True quando valores.json (agregado) existe; false para particionado-anual."
    },
    "paridade-contra-usd": {
      "type": "boolean",
      "description": "Presente em séries de câmbio: True quando a paridade é contra o dólar americano."
    },
    "nota-data-hora-fonte": {
      "type": "string",
      "description": "Nota sobre a semântica de data-hora-fonte (câmbio)."
    }
  },
  "allOf": [
    {
      "description": "Combinações armazenamento × frequência × agregado-disponivel (aplicado apenas quando armazenamento é declarado)",
      "if": {
        "properties": {
          "armazenamento": { "const": "agregado-e-anual" }
        },
        "required": ["armazenamento"]
      },
      "then": {
        "properties": {
          "frequencia": { "enum": ["mensal", "anual"] },
          "agregado-disponivel": { "const": true }
        }
      },
      "else": {
        "if": {
          "properties": {
            "armazenamento": { "const": "particionado-anual" }
          },
          "required": ["armazenamento"]
        },
        "then": {
          "properties": {
            "frequencia": { "const": "diaria" },
            "agregado-disponivel": { "const": false }
          }
        }
      }
    }
  ]
}
